{
  "schemaVersion": 1,
  "scenarioFamily": "N0",
  "variant": "CONTROL",
  "primaryPlane": "DELIVERY",
  "deliveryFaults": [],
  "transportFaults": [],
  "networkFaults": [],
  "providerFaults": [],
  "routeFaults": [],
  "storageFaults": [],
  "randomSeed": null,
  "requiresActualDefaultNetwork": false
}
