{
  "schemaVersion": 1,
  "scenarioFamily": "N6",
  "variant": "SLOW_CLOSE",
  "primaryPlane": "TRANSPORT",
  "deliveryFaults": [],
  "transportFaults": [
    {
      "faultId": "media-transport-fault",
      "plane": "TRANSPORT",
      "kind": "SLOW_CLOSE",
      "stochastic": false,
      "parameters": {
        "delayMs": 1000,
        "direction": "DOWNSTREAM",
        "scope": "MEDIA_DATA_ONLY"
      }
    }
  ],
  "networkFaults": [],
  "providerFaults": [],
  "routeFaults": [],
  "storageFaults": [],
  "randomSeed": null,
  "requiresActualDefaultNetwork": false
}
