{
  "schemaVersion": 1,
  "scenarioFamily": "N3",
  "variant": "BURST_PACKET_LOSS",
  "primaryPlane": "NETWORK",
  "deliveryFaults": [],
  "transportFaults": [],
  "networkFaults": [
    {
      "faultId": "media-path-blackout",
      "plane": "NETWORK",
      "kind": "BURST_PACKET_LOSS",
      "stochastic": false,
      "parameters": {
        "lossPpm": 1000000,
        "durationMs": 1500,
        "scope": "MEDIA_PATH_ONLY"
      }
    }
  ],
  "providerFaults": [],
  "routeFaults": [],
  "storageFaults": [],
  "randomSeed": null,
  "requiresActualDefaultNetwork": false
}
