{
  "schemaVersion": 1,
  "scenarioFamily": "N6",
  "variant": "TRANSPORT_READ_TIMEOUT",
  "primaryPlane": "TRANSPORT",
  "deliveryFaults": [],
  "transportFaults": [
    {
      "faultId": "media-transport-fault",
      "plane": "TRANSPORT",
      "kind": "READ_TIMEOUT",
      "stochastic": false,
      "parameters": {
        "timeoutMs": 0,
        "direction": "DOWNSTREAM",
        "scope": "MEDIA_DATA_ONLY"
      }
    }
  ],
  "networkFaults": [],
  "providerFaults": [],
  "routeFaults": [],
  "storageFaults": [],
  "randomSeed": null,
  "requiresActualDefaultNetwork": false
}
